url,title,post_text
https://www.reddit.com/r/explainlikeimfive/comments/1p39v3g/eli5_what_is_a_is_retrievalaugmented_generation,Eli5 what is a is retrievalaugmented generation,"Someone on our marketing team is pushing for us to build out a RAG system on our customer-facing site, but I can’t picture what it would look like or how it would help our department. The use cases I’ve seen for RAG in customer-facing content is for customer support. Our team is focused on SEO/GEO optimization, and I don’t see how this benefits us, but I’m probably just missing something.

I also just can’t practically visualize what it would look like. I literally need the most simplified explanation possible.

(Yes, my username is very stupid. I created before I understood this platform. 🤡)"
https://www.reddit.com/r/explainlikeimfive/comments/1p30xxk/eli5_how_do_projectors_display_black_letters,Eli5 how do projectors display black letters,"In class just zoning off , I’m very tired so it might be an obvious answer , but as far as I know black is not a color , so how do projectors display black letters against white backgrounds. Thanks for all responses!"
https://www.reddit.com/r/explainlikeimfive/comments/1p3w4yi/eli5_why_do_we_even_have_earwax_do_we_really_need,Eli5 why do we even have earwax do we really need,"I’ve been wondering - why do humans produce earwax in the first place? If we never had tools to clean it, how was it “supposed” to be removed? Why don’t other animals clean their ears? And if it exists for a reason, do we really need to constantly clean it? Please calm me down and help.

EDIT: In my family, we clean ears literally every day. Cotton swabs most of the time, sometimes hydrogen peroxide. My boyfriend rarely cleans his, so I make him do it. I thought I was helping, but apparently over-cleaning is actually harmful. Now I feel so ashamed.(((

EDIT 2: Last night I apologized to him for any discomfort from my over-cleaning. He said it’s fine, and everything’s okay. Also, I’ve been thinking that if we ever want to peek safely, something like a Bebird camera is way less invasive than cotton swabs."
https://www.reddit.com/r/explainlikeimfive/comments/1p3xa5t/eli5_how_does_test_cricket_work,Eli5 how does test cricket work,What
https://www.reddit.com/r/explainlikeimfive/comments/1p232pz/eli5_why_is_it_not_recommended_to_cut_anything,Eli5 why is it not recommended to cut anything,
https://www.reddit.com/r/explainlikeimfive/comments/1p3tg4r/eli5_how_the_size_of_a_game_can_be_optimized,Eli5 how the size of a game can be optimized,I don't understand is how a game can be optimized to reduce file size without removing any features.
https://www.reddit.com/r/explainlikeimfive/comments/1p2d08i/eli5_can_people_be_naturally_dopamine_deficient,Eli5 can people be naturally dopamine deficient,"If it does exist, is there a way to help this condition? Is there medication that increase dopamine without receiving a high or kick like on cocaine/crack? I know some legal stimulants increase dopamine. I know doctors are reluctant to prescribe those unless you have an ADHD diagnosis. It feels like it would help with depression too. It's better than illegal drugs because of the therapeutic dose. What am I missing? Just want to have a better understanding."
https://www.reddit.com/r/explainlikeimfive/comments/1p2j0l4/eli5_can_one_use_other_metals_as_filaments_in,Eli5 can one use other metals as filaments in,
https://www.reddit.com/r/explainlikeimfive/comments/1p261z4/eli5_why_warships_are_likely_to_use_turbine,Eli5 why warships are likely to use turbine,"I read specifications of commercial ships (cruise, container, tanker) and they appear to mostly use diesel power generators. Warships OTOH appear to use turbine engines, even though their displacements are way below large commercial ships. First question is whether my observation is right. Second question if it is right is what are the reasons."
https://www.reddit.com/r/explainlikeimfive/comments/1p1w4wx/eli5_why_does_cocaine_need_to_be_snorted_surely,Eli5 why does cocaine need to be snorted surely,
https://www.reddit.com/r/explainlikeimfive/comments/1p1yghx/eli5_when_we_say_plastics_will_take_hundreds_of,Eli5 when we say plastics will take hundreds of,
https://www.reddit.com/r/explainlikeimfive/comments/1p3s3y1/eli5_why_dont_men_underwear_have_cup_sizes,Eli5 why dont men underwear have cup sizes,"I don't understand why we don't have cup sizes for men in the same fashion women's bras do. I can't be the only one who has trouble finding the right size, where the hip fits right but the crotch is too tight, or the crotch fits but the hip band is loose. Right?

The internet's explanation seems to be ""because it supports different anatomies"", which is like saying water is wet."
https://www.reddit.com/r/explainlikeimfive/comments/1p3myv5/eli5_why_do_crosswalk_buttons_yell_at_you_after,Eli5 why do crosswalk buttons yell at you after,"When you press the crosswalk button like 10 times, it suddenly goes from the normal ‘wait’ to a much louder ‘WAIT to cross \_\_\_ road.’ I’ve tried looking this up but can’t find anything explaining why it gets louder like that. I figured it might be an accessibility feature, but I’m not sure why a person with a disability would need to press it that many times. The only people I ever see spamming it like that are kids. Does anyone know why it triggers that louder message?"
https://www.reddit.com/r/explainlikeimfive/comments/1p1w9kx/eli5_how_does_alcohol_have_calories_but_no,Eli5 how does alcohol have calories but no,
https://www.reddit.com/r/explainlikeimfive/comments/1p1vxql/eli5_how_is_qr_code_so_durable_and_usable,Eli5 how is qr code so durable and usable,"I just scanned multiple coupons in the form of scratch tickets with a qr code underneath. On one of the codes, I accidentally scraped hard enough to bruise a bit of the image and visibly white out some parts, but the app can scan it just fine. How does that work?"
https://www.reddit.com/r/explainlikeimfive/comments/1p3hqg5/eli5_why_do_doctors_give_diabetes_meds_but_then,Eli5 why do doctors give diabetes meds but then,"I've never been a sugar lover, never really had a sweet tooth. I've cut sodas and other sugary drinks out of my life for about 5+ years. I don't drink any alcohol or smoke. I cook my own food (non processed food, generally medium carbs) 4-5 days a week. So I really don't know where or how I was diagnosed with diabetes 2 months ago, but that's a question for another day.

Since i was prescribed Gliclazide by my doctor, some days I get hypo and I'd have to take sugary drinks, eat snacks or whatever, which I am not used to and it's a hassle for me to bring sugary snacks everywhere i go.

My question is, since I eat exactly how I did before i was diagnosed, so if it raised my blood sugar to the point that i am considered diabetic then why isn't it enough to normalize my blood sugar with the meds?"
https://www.reddit.com/r/explainlikeimfive/comments/1p1vot1/eli5_how_does_cannibalism_increase_the_risk_of,Eli5 how does cannibalism increase the risk of,It's well known that cannibalism can lead to diseases like kuru in humans and mad cow disease in cows. What is the mechanism that allows these conditions to develop because of cannibalism?
https://www.reddit.com/r/explainlikeimfive/comments/1p2acga/eli5_how_do_vod_services_benefit_by_renting,Eli5 how do vod services benefit by renting,"Like with a physical DVD, you can rent the same DVD to multiple people. But with an online movie, the service already owns the movie, and not a lot of people rents the same movie twice or more so how can they rent for cheaper and still get the same profit"
https://www.reddit.com/r/explainlikeimfive/comments/1p212jl/eli5_how_and_why_do_economic_bubbles_in_history,Eli5 how and why do economic bubbles in history,"I'm nowhere near an economist, so please help me understand:
1. How does money start circulating in a way that inflates everything beyond reality?
2. What usually triggers the “pop”?
3. And what does it *feel like* for normal people when one of these famous bubbles finally bursts?"
https://www.reddit.com/r/explainlikeimfive/comments/1p25tgz/eli5_how_does_the_banach_and_tarski_paradox,Eli5 how does the banach and tarski paradox,
https://www.reddit.com/r/explainlikeimfive/comments/1p38adc/eli5_blood_typing_tests,Eli5 blood typing tests,"# How are blood typing tests done through labs like LabCorp and Quest to ensure the result is accurate?

# I guess I'm curious about the process and if it is any different than tests that would be done in a hospital lab in emergency situations for transfusions, etc. Thinking about getting a test because I'm curious about mine, but my OCD has me worried about them cutting corners and yes, I understand that knowing your blood type is not necessary because you'll always be typed when blood is needed. Like I said, I'm simply wondering about the process for accuracy!"
https://www.reddit.com/r/explainlikeimfive/comments/1p1sy5l/eli5_b1_bombers_leaking_hydraulic_fluid,Eli5 b1 bombers leaking hydraulic fluid,"A few years ago we went to an airshow, a pretty well known airforce base right next to us and on their B1, they had atleast 6 buckets and I believe lines running from the plane to the buckets for leaking pink hydraulic fluid. I asked one of the captains why that was and from what I remember just said these planes leak so much fluid until they get to temp and expand up in the air.

For how much hydraulic fluid it was, I can't believe they could even move the ""flaps"". What would cause that and is it true?"
https://www.reddit.com/r/explainlikeimfive/comments/1p1hska/eli5_why_do_usbc_cables_have_chips_in_them,Eli5 why do usbc cables have chips in them,"I have heard that USB-C and Thunderbolt cables are called ""active cables"", because they have chips embedded in the slightly oversized connectors. But why do they have them? What's the advantage to putting the chips in the connectors instead of just inside the devices you're connecting?

Never mind for a minute how frustrating it is that different USB-C cables have different capabilities and power transfer wattages. I know that's all down to the vendors and the committee that designed USB-C not agreeing on standards (super annoying!)"
https://www.reddit.com/r/explainlikeimfive/comments/1p29hgk/eli5_why_does_video_seem_to_have_areas_of_low,Eli5 why does video seem to have areas of low,"I’ve noticed for a while that while watching a locally downloaded movie on VLC, there will be moments of… static/damaged/highly distorted video that immediately (or mostly) resolve upon a scene change, but don’t resolve when trying to scrub backwards. For that time I’ve just figured it was some sort of VLC issue; I’ve been watching Netflix with a pretty rough wi-fi connection while on holiday, and I’ve noticed that similarly I’ll open the Netflix app after moving to another app, and the video will resume in a (very similar to VLC) terrible quality/with distortion that immediately resolves itself when there is a change in scenes - from two characters in a car to the car travelling down the road, for example.

My limited knowledge of video media suggests that this is a compression issue - (from my understanding) an entire scene can be compressed as the colours, lighting, movement is fairly constant, but the next scene - presenting an entire new image, must be… redrawn(?) from the ground up, with a fresh set of information.

Like with any subject I’m not an expert in (which is all of them) I know I’m embarrassing myself, but life is for learning, isn’t it? Cheers!

Edit: you can choose to additionally explain in a way that makes me google every third word. I’ll figure it out and be enriched all the more for it. <3"
https://www.reddit.com/r/explainlikeimfive/comments/1p25w8v/eli5_faraday_cage_and_openings_on_the_cage,Eli5 faraday cage and openings on the cage,"In the context of a Faraday cage, I’m trying to understand the behavior of electromagnetic interference (EMI) signals or to make it simple, lighting strike, when it encounters a conductive metallic enclosure with regularly spaced openings. Specifically, I have two questions:

1. If the cage has holes, how does the EMI field still fail to pass through these openings? Why does the electromagnetic energy remain confined to the surface of the metallic structure instead of propagating through the gaps?
2. When the EMI signal hits the metal cage, what happens to that energy? Is it reflected back toward the source, absorbed and dissipated within the material, or does it simply remain distributed on the surface of the chassis? In other words, how does the EMI “return” or resolve once it interacts with the cage?"
https://www.reddit.com/r/explainlikeimfive/comments/1p30zzn/eli5_if_time_is_relative_can_two_people_age,Eli5 if time is relative can two people age,"I’ve heard in physics that time is not the same for everyone and can pass differently depending on speed or gravity.

But if two people are just sitting in the same room, at normal speed, would one age differently than the other?

How does this actually work? Can relativity make even tiny differences in aging, or is it completely negligible?

Thanks in advance!

Edit : apologies and thank you all for your explanations!"
https://www.reddit.com/r/explainlikeimfive/comments/1p1w86v/eli5_the_difference_between_freeware_free,Eli5 the difference between freeware free,"I have a paper coming up and all these very similar yet different jargons are making my head hurt. Scoured the internet amd Couldn't find and explanation that dealt with all four of these. And when I searched for it seperately, some was just the same thing with a different name. Someone help me please"
https://www.reddit.com/r/explainlikeimfive/comments/1p1aggz/eli5_what_is_the_oneelectron_universe_theory,Eli5 what is the oneelectron universe theory,"This theory seems to pop up in headlines, and even movies.  How can their only be one electron in the universe, or proton moving backwards in time.

Edit: apparently it's ""positron"", as opposed to proton.

Edit 2: also this is clearly referred to as a hypothesis, and not a theory.

Apologies and thanks for the responses."
https://www.reddit.com/r/explainlikeimfive/comments/1p1ivog/eli5_why_does_windows_disallow_naming_a_file_or,Eli5 why does windows disallow naming a file or,
https://www.reddit.com/r/explainlikeimfive/comments/1p1bnxo/eli5_if_exercising_muscles_makes_them_stronger,Eli5 if exercising muscles makes them stronger,"When we work out our arm or leg muscles, they get stronger because the body repairs the tiny damage and builds more muscle.

But when we “stress” other body parts, the opposite happens:

* Eating a lot of cholesterol → heart problems instead of a stronger heart
* Eating lots of food → stomach and metabolism issues instead of a stronger digestive system
* Lots of screen time → worse eyesight instead of stronger eyes

Why do muscles get stronger from stress, but other organs just get damaged?

Is it because they’re made of different kinds of muscle? Or because they’re not meant to handle that kind of stress?"
https://www.reddit.com/r/explainlikeimfive/comments/1p2eb02/eli5_whyhow_does_cold_water_cause_pain,Eli5 whyhow does cold water cause pain,"Context: While kayaking I stepped into a part of the river that was significantly colder than other parts. As soon as my feet submerged in the water, I felt pain in them similar to a really bad cramp that penetrated all the way to my bones (not literally, but that's what it felt like). Not like pins and needles, but it was physically difficult to move at all, even to step out of the water.
Please ELI5, I'm so curious!"
https://www.reddit.com/r/explainlikeimfive/comments/1p14fdn/eli5_how_does_your_skin_know_how_thick_to_make_a,Eli5 how does your skin know how thick to make a,
https://www.reddit.com/r/explainlikeimfive/comments/1p204sv/eli5_why_do_our_voices_sometimes_go_croaky_when,Eli5 why do our voices sometimes go croaky when,
https://www.reddit.com/r/explainlikeimfive/comments/1p32rwh/eli5_how_does_chatgpt_run_so_quickly_if_theres_so,Eli5 how does chatgpt run so quickly if theres so,I don’t know much about coding or CS. But when I run lines of code it takes so time and it’s not complex code. But when ChatGPT is ran it gives so much info in a matter of seconds. How does that happen?
https://www.reddit.com/r/explainlikeimfive/comments/1p1cmzx/eli5_how_does_a_jet_engine_keep_the_expanding_gas,Eli5 how does a jet engine keep the expanding gas,"The explanations I've read (including on prior ELI5s) feel circular:

1) The gas from the combustion chamber can't go into the compressor because the air in the compressor is under high pressure.
2) The air in the compressor is under pressure because the compressor is being turned by a rotor, which is being driven by the turbine.
3) The turbine is turning because the expanding gas from the compression chamber flows out the back of the engine.

So our answer has brought us right back to the question we started off trying to answer.

Intuitively it seems like the gas pushing back (turning the turbine), and the gas pushing forward (backfeeding the compressor) should cancel out and stall the engine.

I suppose my question is how can the pressure from the combustion be sufficient to drive a turbine, that drives a compressor, that generates a pressure that overcomes the pressure of the combustion that started the whole process?

I feel like there is some critical principle of fluid dynamics I am missing."
https://www.reddit.com/r/explainlikeimfive/comments/1p2s711/eli5_why_climbing_mount_everest_is_so_difficult,Eli5 why climbing mount everest is so difficult,
https://www.reddit.com/r/explainlikeimfive/comments/1p0m88s/eli5_why_do_the_symptoms_of_pregnancy_so_closely,Eli5 why do the symptoms of pregnancy so closely,"Chills, constant nausea, vomiting, low energy, low appetite. Why?"
https://www.reddit.com/r/explainlikeimfive/comments/1p151wc/eli5_why_do_we_feel_more_awake_after_being_in_the,Eli5 why do we feel more awake after being in the,"So, I notice whenever I wake up I feel sleepy as hell. But after walking to school in the cold morning air, usually I'm awake and alert. The same occurs if you take a cold shower. Why is this?"
https://www.reddit.com/r/explainlikeimfive/comments/1p1fcxk/eli5_how_do_scientists_group_exctinct_animals,Eli5 how do scientists group exctinct animals,"I  hear that animals are grouped using phylogeny rather than taxonomy.  I like learning lots about how animals are grouped, but I wonder. What is the process for anylizing the genetics? Is it the same for dinosaur bones? I always wondered how they classify animals and what tools scientists use."
https://www.reddit.com/r/explainlikeimfive/comments/1p26q6z/eli5_why_does_the_same_temperature_feel_colder_at,Eli5 why does the same temperature feel colder at,"I've lived through 10°C on a hill as well as 10°C at sea level, yet somehow the one on the hill feels colder. Why?

I get that the temperature itself is the same, but why does _my body_ experience it as colder? What’s happening physically or biologically that changes how we feel the same temperature at different altitudes?"
https://www.reddit.com/r/explainlikeimfive/comments/1p1fwxh/eli5_how_do_radioisotope_thermoelectric,Eli5 how do radioisotope thermoelectric,"I'm a space/tech nerd, and... they make no sense.

How do we get electricity just from electrons moving from hot to cold? Are there more steps that I missed?"
https://www.reddit.com/r/explainlikeimfive/comments/1p1kyhw/eli5_in_what_ways_does_our_genetics_influence_our,Eli5 in what ways does our genetics influence our,"Basically, what in the body makes the voice have the sound it has? And how can this impact you when singing? Are some just doomed to sing badly?"
https://www.reddit.com/r/explainlikeimfive/comments/1p0tikj/eli5_why_is_it_hot_and_neutral_on_a_wall_socket,Eli5 why is it hot and neutral on a wall socket,"**TL;DR: Why is Ground on a computer chip the intended path of electricity, when on a wall socket it's not?**

I understand that a wall socket has 3 ports: (Hot/Positive, Neutral, and Ground). The intended path is electric current out from Hot to Neutral, with Ground being an optional fail safe to protect from short circuits/live chassis.

On a computer chip, say a Raspberry Pi Pico or a small control chip, there is usually a pin labelled for ""Voltage in"", which makes sense, but usually also ""Ground"", which the intended use is to complete the circuit for powering these devices (Vcc -> GND to power the chip). I understand a Voltage is a measurement of potential difference, so it is usually compared to a point of 0V (Ground). But why in a chip is ground the intended path of electricity?

Lastly, a battery. I understand that a battery has a positive and negative side, and the polarity (in laymans terms) attracts electrons from the negative to the positive side (and pushes from negative to positive. In a circuit, the intended path of electricity is from one end of the NEGATIVE to the POSITIVE.

Why do we call it ""(Hot)Positive/Neutral"", ""Voltage in(Positive)/Ground"", and ""Positive/Negative"" in these cases? Is it just terminology difference or do these three cases operate differently?"
https://www.reddit.com/r/explainlikeimfive/comments/1p1ox6z/eli5_what_are_the_main_neurotransmittersmolecules,Eli5 what are the main neurotransmittersmolecules,"Just thinking of tattoo ideas and I think this would be a kinda cool concept. From what I've found from googling, it seems like it's mostly to do with glutamate/GABA, then also involving epinephrine and norepinephrine (?).

Mainly I'm looking is: what molecules are creating a 'balancing' effect in the brain's response to acutely stressful situations?

Bonus points if you can come up with a way that this could visualised creatively  :)

Thank you!"
https://www.reddit.com/r/explainlikeimfive/comments/1p1kq38/eli5_how_do_web_server_providers_and_web_servers,Eli5 how do web server providers and web servers,"After what happened with Cloudflare yesterday I am curious, how exactly does servers that ""host websites"" work and why weren't websites like youtube affected?
At the same time websites like twitter had its services slowed while independant websites stopped working."
https://www.reddit.com/r/explainlikeimfive/comments/1p2jaws/eli5_why_do_we_need_to_wear_underwear,Eli5 why do we need to wear underwear,"Just a question, but why do we need to wear underwear?

I have never seen a reason to wear boxers, i’m not afraid of my pants ripping in half or peeing my pants. So what is the reason people wear underwear?"
https://www.reddit.com/r/explainlikeimfive/comments/1p06kfc/eli5_women_are_recommended_to_pee_after_sex_why,Eli5 women are recommended to pee after sex why,"Sex can push bacteria to enter the women’s urethra due to the thrusting (that’s the best I can describe it).  But considering that it’s the man doing the thrusting and where their urethra is, should it not be recommended more to men?"
https://www.reddit.com/r/explainlikeimfive/comments/1p0pmdg/eli5_can_a_link_look_legitimate_at_first_but,Eli5 can a link look legitimate at first but,"I don't know how to explain it better, but I hope you understand: is it possible that there is a link, like this (this is a blurred fake link  https://account.microsoft.com/dbxydYsjdhahYuuhagsgUyh) : the front half seems legitimate, but then the second half of the link could lead you into something else (like a hacking site that steals all your details)?"
https://www.reddit.com/r/explainlikeimfive/comments/1p0fl4y/eli5_why_did_touching_crt_tvs_create_static_shock,Eli5 why did touching crt tvs create static shock,"I’m 31 and my family had CRT TVs until maybe 2003 or 2004 and I remember that touching, or getting close to touching, the screen would set off a static shock.

I haven’t had that experience in decades with any plasma, LCD, OLED, or QLED TVs but haven’t really thought about that until now.

Why do modern TVs not generate static electricity?"
https://www.reddit.com/r/explainlikeimfive/comments/1p0b0pz/eli5_pounds_per_square_inch_why_are_my_car_tires,Eli5 pounds per square inch why are my car tires,
https://www.reddit.com/r/explainlikeimfive/comments/1p25cz4/eli5_what_is_guantanamo_bay_and_why_is_it_so,Eli5 what is guantanamo bay and why is it so,
https://www.reddit.com/r/explainlikeimfive/comments/1p08lvc/eli5_how_can_scientists_take_pictures_of_atoms,Eli5 how can scientists take pictures of atoms,
https://www.reddit.com/r/explainlikeimfive/comments/1p1zvz4/eli5_are_indians_aryans_then_what_is_their,Eli5 are indians aryans then what is their,topic
https://www.reddit.com/r/explainlikeimfive/comments/1p1suph/eli5_how_did_vcrs_record_live_tv,Eli5 how did vcrs record live tv,"Both practically (how the VCR connected to the tv to record) and literally (how the show went from the tv to a tape)?

Edit: and how come this wasn’t considered piracy? Or was it and studios just didn’t care?

Edit 2: could you connect two vcrs together and just keep re-recording the same show to get multiple copies? Open your own little rental shop but avoid licensing or borrowing fee or however it worked?"
https://www.reddit.com/r/explainlikeimfive/comments/1p0nxlw/eli5_what_is_happening_physiologically_when_you,Eli5 what is happening physiologically when you,
