url,title,post_text
https://www.reddit.com/r/explainlikeimfive/comments/1p94c19/eli5_why_do_certain_foods_taste_so_disgusting,Eli5 why do certain foods taste so disgusting,"my sweet n sour sauce from mcdonald’s tastes like blood, but when i eat my fries without it it’s fine. i’ve been very sick for the past few days."
https://www.reddit.com/r/explainlikeimfive/comments/1pa8pte/eli5_its_snowing_and_its_neither_cold_nor_dark,Eli5 its snowing and its neither cold nor dark,Pic for reference. https://imgur.com/a/1MzX3JI
https://www.reddit.com/r/explainlikeimfive/comments/1p9fns0/eli5_whats_the_difference_between_serotonin_and,Eli5 whats the difference between serotonin and,SSRI is SSNI kinda thing
https://www.reddit.com/r/explainlikeimfive/comments/1p8t5jf/eli5_why_having_greyscale_instead_of_color_on_the,Eli5 why having greyscale instead of color on the,
https://www.reddit.com/r/explainlikeimfive/comments/1pa97fc/eli5_why_does_water_harden_when_your_body_hits_it,Eli5 why does water harden when your body hits it,"In Stranger Things, Hopper says something along the lines of “Fall into water at that height, and it’ll hit you like cement.” Does this claim have any merit? If so, why does this happen?"
https://www.reddit.com/r/explainlikeimfive/comments/1pa6ak5/eli5_why_is_there_less_and_less_advertising_for,Eli5 why is there less and less advertising for,
https://www.reddit.com/r/explainlikeimfive/comments/1p94zwd/eli5_why_are_consistent_dopamine_hits_like_from,Eli5 why are consistent dopamine hits like from,"i think this falls under biology. anyways, maybe i’m just forgetting something but !! i thought dopamine was like. good happy drug. why is it bad to get it lots ?"
https://www.reddit.com/r/explainlikeimfive/comments/1p9idyf/eli5_do_hitting_photons_on_an_object_cause,Eli5 do hitting photons on an object cause,
https://www.reddit.com/r/explainlikeimfive/comments/1p8ecx5/eli5_how_come_fast_speeds_on_roller_coasters_feel,Eli5 how come fast speeds on roller coasters feel,"Take Xcelerator at Knotts Berry Farm for example, when you go on the ride and it shoots you foward in the beginning at 82 MPH, your stomach drops and the wind forces your head to go back. When driving 82 MPH on a highway, it feels like nothing and you don’t even notice how fast you’re going. Sorry if this is a dumb question, i was just wondering as I went to knotts yesterday and kept this in my head all day long😹 Thanks!"
https://www.reddit.com/r/explainlikeimfive/comments/1p8q3nm/eli5_why_are_so_many_venomous_animals_so_op,Eli5 why are so many venomous animals so op,"I was reading online today that the most venomous snake is the inland taipan which one drop of venom can kill 100+ men. Ive read similar figures before, however, when most venomous creatures like snakes or spiders are basically only eating small mammals, invertebrates, or amphibians, why is it that their venom is so potent and deadly? Surely a fraction of the venom would be enough to kill their prey, so how did they get to be so OP?"
https://www.reddit.com/r/explainlikeimfive/comments/1p8lq7t/eli5_why_it_seems_like_microwaves_are_more,Eli5 why it seems like microwaves are more,"I just compare them to flat screen tvs. I remember buying a 22"" shit brand flat screen(720p?) for 220$ in 2009ish.  Fast forward to 2025 and you can get a Samsung 65inch(4k) for 320$

Yet somehow microwaves are the same/more expensive than a decade ago. And it's technology that has remained largely unchanged since the 50s. And almost entirely unchanged since the 80s.

What gives?"
https://www.reddit.com/r/explainlikeimfive/comments/1p8hzmf/eli5_why_can_mosquitoes_and_small_flies_just_have,Eli5 why can mosquitoes and small flies just have,"Sometimes I see flies or mosquitoes mid flight and I hit them with an open hand really hard.
How do they keep flying even tho I slapped it so hard like they do on the slap battles show midair  and it just stays in the air and keeps flying"
https://www.reddit.com/r/explainlikeimfive/comments/1p9tz7n/eli5_how_things_like_action_replay_gc_patch_ram,Eli5 how things like action replay gc patch ram,
https://www.reddit.com/r/explainlikeimfive/comments/1pa2zy8/eli5_why_is_proper_tailoring_more_common_in,Eli5 why is proper tailoring more common in,"Surely it’s not that expensive anymore to cut clothes decently… yet most garments at shops like H&M, target etc rarely sit right on the body"
https://www.reddit.com/r/explainlikeimfive/comments/1pa4f26/eli5_if_nature_wants_us_to_multiply_why_is,Eli5 if nature wants us to multiply why is,"Especially when compared to the actual act of conception, which seems to be intentionally pleasant."
https://www.reddit.com/r/explainlikeimfive/comments/1p9tqk4/eli5_how_does_kmeans_figure_out_which_points,Eli5 how does kmeans figure out which points,.
https://www.reddit.com/r/explainlikeimfive/comments/1p86vyq/eli5_how_can_i_buy_a_2_cable_from_china_with_free,Eli5 how can i buy a 2 cable from china with free,"I run a small online shop. Shipping costs are my biggest nightmare.

I don't understand the economics. A package travels 7,000 miles across an ocean for pennies, but if I want to send a package to a customer two states away, the post office wants $15.

Who is subsidizing that international shipping? How is it physically possible to make a profit on a $2 item with shipping included?"
https://www.reddit.com/r/explainlikeimfive/comments/1p97exp/eli5_propeller_efficiency,Eli5 propeller efficiency,"I’m horrible with physics. Reading a book on the Olympic class ships and their contemporaries (Olympic, Titanic, Britannic, Lusitania, Aquitania, Mauretania) and there’s a section about propeller efficiency. It does not go deep into it, but it mentions that the parent companies for these ships tried various types of propellers for each ship. It says that fewer blades meant more efficiency, but more vibration. That’s why Lusitania and Mauretania went from three bladed props to four blades, while the Olympic went back and forth with a three and four bladed central propeller over her lifetime. More blades equaled less efficiency but less vibration. Why is this so? I find this kind of fascinating."
https://www.reddit.com/r/explainlikeimfive/comments/1p91x3c/eli5_is_it_advised_to_keep_old_lithium_ion,Eli5 is it advised to keep old lithium ion,I feel like I'm constantly seeing videos of LI batteries expanding or catching fire and I have a drawer full of old phones. Is this a bad move? What dictates if an LI battery expands and catches fire?
https://www.reddit.com/r/explainlikeimfive/comments/1p97iu5/eli5_why_does_food_taste_like_nothing_when_you,Eli5 why does food taste like nothing when you,
https://www.reddit.com/r/explainlikeimfive/comments/1p8opdj/eli5_why_do_some_twinengine_fighter_jets_have_one,Eli5 why do some twinengine fighter jets have one,"I've been going down a fighter jet rabbit hole lately, and was wondering why some twin-engine jets have one vertical stabilizer (F-4, Typhoon, Rafale, etc.), and others have two (F-14, F-15, Su-27, etc.)"
https://www.reddit.com/r/explainlikeimfive/comments/1p7y51f/eli5_why_do_humans_lose_muscle_so_quickly_while,Eli5 why do humans lose muscle so quickly while,"Why humans start losing muscle pretty fast if we stop working out, but chimpanzees or gorillas stay extremely muscular and strong even without doing anything that resembles “gym training” ?"
https://www.reddit.com/r/explainlikeimfive/comments/1p8rqfi/eli5_if_the_universe_started_with_a_huge,Eli5 if the universe started with a huge,"If you have an explosion in a vacum, wouldn't all matter be disspersed equally and keep moving away from the other particles? How can we then have galaxies that end up moving towards each other?"
https://www.reddit.com/r/explainlikeimfive/comments/1p8j43p/eli5_how_come_a_square_wave_is_composed_of,Eli5 how come a square wave is composed of,"I read that a square is composed of infinite number of sine waves having different frequencies. I couldn't wrap my head around this.

How it is actually true. Are we saying it because, a square wave is not a naturally occurring phenomena?

Can someone provide an ELI5 answer with an intuitive, simply analogy to understand how come a square wave is composed of infinite number of small sine waves?"
https://www.reddit.com/r/explainlikeimfive/comments/1p9xgvd/eli5_when_older_people_tell_stories_why_do_they,Eli5 when older people tell stories why do they,"For example:

“I was 15 and was with Edith McCullen at swim practice. We saw Billy Bob Robinson and he asked her to the prom, but he was secretly dating Ruth Smith.”

Does this have to do with aging? Memory? I seldom hear people who aren’t elderly refer to people by their first and last name unless it’s for a reason."
https://www.reddit.com/r/explainlikeimfive/comments/1p9mozl/eli5_what_is_daylight_saving,Eli5 what is daylight saving,I still cannot understand it
https://www.reddit.com/r/explainlikeimfive/comments/1p811df/eli5_how_much_water_does_your_body_actually_use,Eli5 how much water does your body actually use,"Drank like, a whole bottle of water, and only half comes out. Ain't the first time, just wonderin'."
https://www.reddit.com/r/explainlikeimfive/comments/1p9jrof/eli5_why_are_we_not_supposed_to_give_babies_any,Eli5 why are we not supposed to give babies any,"I’ve been trying to read up on this online but it didn’t seem to find anything that explained it well. I guess when babies turn 2+ years we introduce them to our normal diet? So any reason why we’re skipping salt and sugar entirely in the first 1/2 years?

Thanks in advance!"
https://www.reddit.com/r/explainlikeimfive/comments/1p8k1pd/eli5_what_are_the_main_advantages_and,Eli5 what are the main advantages and,I've been reading up a bit more on how Muay Thai works and all that good stuff and noticed they stand with their waist straight facing their opponents and feet next to each other while boxers have one foot in front of the other. I'm curious if anyone was able to tell me what the main differences and setbacks would be and if there is a definite best stance?
https://www.reddit.com/r/explainlikeimfive/comments/1p96gx8/eli5_why_do_some_piercings_reject_more_than_others,Eli5 why do some piercings reject more than others,"I’ve never seen an earlobe piercing reject, but everybody I’ve known who had an eyebrow piercing has eventually had to take it out due to rejection. Obvious my experience isn’t universal, but is there a reason that a piercing of the same material will reject in one area and not another?"
https://www.reddit.com/r/explainlikeimfive/comments/1p7vpsz/eli5_what_happens_when_a_crane_operator_has_to,Eli5 what happens when a crane operator has to,Do they keep an empty water bottle? Do they have short enough shifts that they don't need to pee until their shift is over? Simply climbing up and down the ladders seems like it would take up a lot of time.
https://www.reddit.com/r/explainlikeimfive/comments/1p8kdda/eli5_hindsight_bias,Eli5 hindsight bias,"What I know: it’s a psychological theory that aims to describe after a situation has occurred that one knew or couldve predicted the outcome all along. Psychology theories are like mind fuck games to me, so I’d appreciate an easier explanation and / or example of this."
https://www.reddit.com/r/explainlikeimfive/comments/1p7rq95/eli5_why_is_rubbing_your_eyes_bad_so_bad,Eli5 why is rubbing your eyes bad so bad,"I’ve heard that rubbing your eyes is bad for eye health. Thins the cornea or damages the gel-like substance within the eyeballs.

Itchy eyes are such a common problem, and rubbing eyes provides much relief.

Why do so many people vehemently advise not to rub your eyes?"
https://www.reddit.com/r/explainlikeimfive/comments/1p7yotz/eli5_how_come_if_i_point_at_any_thing_to_my_dog,Eli5 how come if i point at any thing to my dog,How does it work? Do other animals understand it? I always thought it's only a human who can do so? Were they always able to do so?
https://www.reddit.com/r/explainlikeimfive/comments/1p9ab3m/eli5_why_does_buying_more_lottery_tickets_barely,Eli5 why does buying more lottery tickets barely,"I’ve always wondered how lottery odds actually work in simple terms. People always say that buying a few extra tickets doesn’t really change anything, and that your odds are still tiny no matter what, but I never fully understood why.
For example, I usually just grab my tickets online through places like Lottoland, and whether I buy one ticket or three, it never feels like the chance is noticeably different. I get that the odds stay extremely small, but I’m trying to understand why adding more tickets only increases your chances a little instead of a lot.
Can someone explain this in the simplest and most basic way possible? Why doesn’t buying extra chances make a big difference?"
https://www.reddit.com/r/explainlikeimfive/comments/1p81igy/eli5_why_does_your_nose_run_when_its_freezing,Eli5 why does your nose run when its freezing,
https://www.reddit.com/r/explainlikeimfive/comments/1p99aje/eli5_if_em_signals_from_our_phones_are,Eli5 if em signals from our phones are,"I have been told the signals from our phones are harmless because they are non-ionizing and don't move electrons around. If that is the case, how do devices receive signals? Surely, the radio waves do something to the devices in order for them to recognize incoming signal, right? How does this effect affect the human body if it is harmless?"
https://www.reddit.com/r/explainlikeimfive/comments/1p98o7u/eli5_why_do_childrens_sleeping_bagsduvets_have,Eli5 why do childrens sleeping bagsduvets have,"A babies sleeping bag is usually 2.5 TOG in winter and a toddlers duvet is typically 4 TOG, why are they so much lower than a full sized adult duvet?"
https://www.reddit.com/r/explainlikeimfive/comments/1p9b8n3/eli5_how_can_we_not_have_cures_to_what_the_body,Eli5 how can we not have cures to what the body,"Let's use COVID as an example. We had this big race to create a vaccine, when people were catching COVID, and getting better. Doesn't that mean their bodies already made the antibodies to beat it? Can we not distribute or copy that cure?"
https://www.reddit.com/r/explainlikeimfive/comments/1p7izmp/eli5_how_do_those_massive_container_ships_stay,Eli5 how do those massive container ships stay,"Was watching this documentary about global shipping and these container ships are absolutely massive. Like some of them carry over 20,000 containers stacked like 8-10 levels high.

But looking at them they seem like they should just topple over immediately. The whole thing looks top heavy as hell, especially when you see them in rough ocean waters getting hit by huge waves from the side.

How is the physics working here? Is there some special engineering that keeps them upright or is it just because the ship itself is so heavy at the bottom? And how do they even figure out where to put each container so the weight is distributed properly?

Also saw that sometimes containers do fall off into the ocean during storms. If the ships are designed to be stable, why does this happen? Is it just when the waves get too crazy or is there some limit to how much movement these things can handle? Makes me nervous about ordering stuff online knowing my package could literally be floating in the Pacific somewhere, especially since I've got like 12k set aside from Stаke for some expensive electronics.

The whole logistics of it seems insane when you think about how much international trade depends on these giant floating apartment buildings full of random stuff not falling over."
https://www.reddit.com/r/explainlikeimfive/comments/1p8fs82/eli5_contact_lenses_vs_eye_glass_lenses,Eli5 contact lenses vs eye glass lenses,"How are contact lenses so much thinner than eye glass lenses? Why are contact lenses thickest in the center and thinnest at the edge whereas eye glass lenses are thinnest in the center and thickest at the edge? Wearing one vs the other, apparent size of things seems bigger (more life like I suppose?) when compared to when wearing eye glasses - why?

After years of wearing glasses, I recently started wearing contact lenses and I am curious about some differences between the two."
https://www.reddit.com/r/explainlikeimfive/comments/1p7m95v/eli5_how_did_people_breed_dogs_to_justpoint_at,Eli5 how did people breed dogs to justpoint at,"Not sure if this actually falls under biology.
My question could expand to other things dogs were bred specifically to do but this was the oddest one out of all the jobs they have I could think of"
https://www.reddit.com/r/explainlikeimfive/comments/1p94kf0/eli5_can_someone_help_me_understand_what_pytorch,Eli5 can someone help me understand what pytorch,I’m new to python and want to learn more. I heard about Zuck offering the guy who built it like $1.5B and he turned it down?
https://www.reddit.com/r/explainlikeimfive/comments/1p96dfr/eli5_why_hasnt_any_animal_taken_advantage_of,Eli5 why hasnt any animal taken advantage of,"This just doesnt add up for me as why didnt an aminal survive like a normal one in the warmer times and hunt hibernating animals as food? Its just confusing for me

EDIT so it was explained and i no lomger am confused bewildered and utterly dumbfounded"
https://www.reddit.com/r/explainlikeimfive/comments/1p7d9j3/eli5_how_can_addiction_be_so_strong_that_even_if,Eli5 how can addiction be so strong that even if,"Why would the brain/body choose addiction over living? Even if you have a “wake up call”, the brain will go back to the addiction. Considering the body is hardwired to normally do EVERYTHING it can to survive… why is addiction a losing battle for many"
https://www.reddit.com/r/explainlikeimfive/comments/1p83uhp/eli5_having_people_play_musical_instruments_in,Eli5 having people play musical instruments in,"They say playing a musical instrument uses so much of the brain that it is a good task for brain functioning.  Yet different instruments and techniques call for different functions: obeying a staff on the ""violin"" vs. loosening up and having at it on ""fiddle."" Some instruments test your breath and lips but not your nondominant hand. Then there's synthesizers, where sound design is often just as important as playing the keys.

Do computer musicians or producers ever take a laptop and make dubstep long after it was mainstream?

Could it be said that it's better to stick to formal techniques during brain surgery instead of just noodling? Or will refraining from noodling be useless when the surgeon effectively lobotomizes you and severs the mesolimbic pathway?

Is this ever done with different skills, like programming a computer, knitting, or ham radio morse code?

Wha are they testing for, and what will they avoid? If it's brain cancer, why not sacrifice your skills if it means you won't have any of the tumor in the brain? It's interesting considering that brain surgery and psych medication embrace opposite approaches: it's socially acceptable to cause people tinnitus, cortical thinning and changed personalities to make them seem socially nicer with antipsychotics, yet removing a tumor has to stop when there's the slightest sign of reduced skill on an instrument.

And I've seen mixed things about whether this helps them if it's too late. Imagine you're a concert violinist or rock god in for a brain tumor removal. Then you witness the exact moment when your skill is quite literally crushed like a cobweb."
https://www.reddit.com/r/explainlikeimfive/comments/1p91vnh/eli5_how_can_brands_sell_advent_calendars_worth,Eli5 how can brands sell advent calendars worth,"obviously tiktok is full of luxury advent calendar’s at the moment and i just saw the vogue one, retails for $520 but contains over $1000 worth of products. how can they afford to do this? i know their profit margins are huge but surely this is just haemorrhaging money? they’re making a massive loss rather than any profit at all, am i missing something?? can someone smart explain to me how they can afford to do this? it’s been on my mind for years now and i’m finally ready to face the embarrassment of admitting how dumb i am to ask the question! thanks :)"
https://www.reddit.com/r/explainlikeimfive/comments/1p727so/eli5_how_come_you_can_go_to_sleep_hungry_but,Eli5 how come you can go to sleep hungry but,
https://www.reddit.com/r/explainlikeimfive/comments/1p8xgto/eli5_why_do_things_float,Eli5 why do things float,"ELI5 why do things float.

I know about Archimedes principle and that things float when the mass of fluid they displace is equal to the mass of the object.
Or rather the buoyant force cancels the gravitational force. But imho that is not an explanation. That is just another factoid describing the Phänomenon in a more scientific way.
The question is: why?  Why does this work in this way?  Why is there a buoyant force and why is it a function of displaced water?
And how can I explain this to a 5 year old?"
https://www.reddit.com/r/explainlikeimfive/comments/1p8xkl2/eli5_how_does_water_out_out_fires,Eli5 how does water out out fires,"I know that water extinguishes (most) fires. Even when using water on a grease fire, the explosion is from the water and oil explode creating millions of tiny “grease bombs” that can eventually be put out.

Some chemicals smother the fire, but how does water extinguish one?  (Think small scale - camping fire, large scale - Hong Kong fire yesterday)"
https://www.reddit.com/r/explainlikeimfive/comments/1p7qi6f/eli5_how_exactly_is_video_game_imagery_lets,Eli5 how exactly is video game imagery lets,"ELI5: Sorry if the question is unclear. Basically, how does the video game know what to show you, and then show it to you? For example Skyrim. Which trees you are close to. How far away that enemy is. What’s behind you if you flick left and turn around?

I remember when I was a kid I thought every action you made, showed you a “premade movie”. Obviously that is not possible. For reference, I’m a younger Millennial who has very little knowledge of video games. Hell I don’t even really know how TV’s work."
https://www.reddit.com/r/explainlikeimfive/comments/1p79scp/eli5_is_there_anything_unique_about_soybeans_that,Eli5 is there anything unique about soybeans that,
https://www.reddit.com/r/explainlikeimfive/comments/1p7f0p5/eli5_through_human_evolution_why_didnt_earlier,Eli5 through human evolution why didnt earlier,
https://www.reddit.com/r/explainlikeimfive/comments/1p7hiqx/eli5_why_does_applying_pressure_to_a_wound_stop,Eli5 why does applying pressure to a wound stop,Why doesn’t more blood flow provide more platelets to the wound and stop the bleeding faster or in the same amount of time?
https://www.reddit.com/r/explainlikeimfive/comments/1p7ivfx/eli5_does_elastic_in_clothing_wear_out_faster,Eli5 does elastic in clothing wear out faster,"It seems like whenever I put on a piece of clothing with elastic (like underwear or a bike jersey with an elastic hem at the bottom) that I haven’t worn in a long while (couple years) it gives off that sickening crinkling sound/texture elastic does when it gives up its elasticity. Which led me to wonder: does elastic do that because it’s not being regularly “exercised,” the same way human tendons would grow less supple from disuse? Or does it just deteriorate at a constant rate no matter how much used or not used? Or does use actually weaken it? It seems like overuse obviously would weaken it, but in a different way than use (stretches it out), but that there must be a happy medium where regular use would help keep it last the longest. Thanks for any insight!"
https://www.reddit.com/r/explainlikeimfive/comments/1p7n80c/eli5_do_parts_of_our_bodies_deteriorate_at,Eli5 do parts of our bodies deteriorate at,"How come an 80 year old struggling to go up and down the stairs can have no trouble writing with a pen? Do different muscles deteriorate differently as we age? If so, why?"
https://www.reddit.com/r/explainlikeimfive/comments/1p867cb/eli5_what_is_the_difference_between_dry_skin_and,Eli5 what is the difference between dry skin and,"On the cellular level and entire skin level, what is going on when skin is “dry” and even cracking, flaking away, etc., and when skin is normal with no visible dryness?"
https://www.reddit.com/r/explainlikeimfive/comments/1p7v1rp/eli5_why_do_songs_seem_catchier_the_more_we,Eli5 why do songs seem catchier the more we,
https://www.reddit.com/r/explainlikeimfive/comments/1p8olre/eli5_why_do_strongmen_only_gain_weight_on_their,Eli5 why do strongmen only gain weight on their,"I know that they don't worry about cutting fat. I know they eat a lot of calories to gain muscle, which causes fat gain. But why is it all *viscera*l fat that they gain? (The fat around your organs beneath the muscle). Their bellies are hard, not soft. They don't have much surface fat anywhere else on their bodies. So why is the fat only gained there specifically? Is it just high amounts of testosterone and HGH? Or does the amount of calories then eat only somehow cause visceral fat? Even other athletes when they bulk gain fat throughout the body. So what's up?

Edit: I'm not trying to hate. These men are seriously impressive. I'm just curious! I should have phrased the title better. More like ""why do they gain so much visceral fat in comparison to regular body fat""."
https://www.reddit.com/r/explainlikeimfive/comments/1p89h6f/eli5_the_difference_between_poetry_spoken_word,Eli5 the difference between poetry spoken word,"Follow question. For poetry that doesn't rhyme, what is the difference between that and regular prose?"
