url,title,post_text
https://www.reddit.com/r/explainlikeimfive/comments/1pigtfr/eli5_how_do_quantum_super_positions_exist_in,Eli5 how do quantum super positions exist in,"Ok, several questions here. I'm just not getting it.

I understand that the ""observer"" in quantum physics isn't literally a conscious person observing a wave/particle. In the ""double slit"" experiment, it's the physical mechanism of the detection device that collapses the wave function. Any interaction with any other thing will cause a collapse into a discrete knowable particle.

But then how do quantum super positions exist at all? There should be none in our bodies, because all of the atoms and energy that make up our cells are always interacting with something. Even in the vacuum of space, there's still cosmic rays and background radiation, right? Do quantum states only exist in laboratory conditions where scientists can control for these?

How do scientists who do the double slit experiment with hydrogen atoms find ones that haven't collapsed into particles yet? This seems to imply that there are atoms on Earth that exist in super positions, but I don't see how they could be on this planet for billions of years without bumping into something else at least once. Are super position atoms very rare atoms? How would you find the rare ones without interacting with them when you check, and immediately collapsing them?

Do particles somehow un-collapse after a refractory period, so the universe is still full of them despite all of the interactions constantly going on? If so, does an electron with a particular spin still have that same spin if it collapses again, or does it totally reset every time?"
https://www.reddit.com/r/explainlikeimfive/comments/1phpq1m/eli5_what_is_the_indian_caste_system_exactly,Eli5 what is the indian caste system exactly,
https://www.reddit.com/r/explainlikeimfive/comments/1phwc14/eli5_how_are_sin_cos_and_tan_useful_outside_of,Eli5 how are sin cos and tan useful outside of,"I don’t fundamentally understand how Sine, Cosine, and Tangent are applicable in fields other than triangle ratios; how is it that something like the ratio of the length of the opposite side to the adjacent side of a right triangle can create a function in a graph or be used in differential equations or integrals and whatnot? Moreover, how can Sine, Cosine, and Tangent be used against numbers? Why can I put sin(1) in my calculator and receive a number back?"
https://www.reddit.com/r/explainlikeimfive/comments/1pikzzx/eli5_how_does_emdr_work,Eli5 how does emdr work,"I've Googled it and have done my own research, but apparently need it ELI5 to grasp and understand the process."
https://www.reddit.com/r/explainlikeimfive/comments/1phwzct/eli5_can_you_get_even_sicker_from_someone_else_if,Eli5 can you get even sicker from someone else if,"if you tested positive for the flu and you have it mildly, can you get even sicker by spending time with/being close to the person who gave it to you? why/why not?"
https://www.reddit.com/r/explainlikeimfive/comments/1pi78aw/eli5_why_do_we_zone_out,Eli5 why do we zone out,"for me, zoning out is i stare at whatever specific spot my brain chooses, my vision goes fuzzy, and i get in a trance like state. if im not in super deep, i can still have thoughts, but in any zone out, i can’t respond to people."
https://www.reddit.com/r/explainlikeimfive/comments/1pj749u/eli5_why_cant_landlines_receive_sms,Eli5 why cant landlines receive sms,"Text messages are increasingly important for communication. Despite many landline phones now having screen displays, those with land line phones are left out.

Why can’t landline phones send and receive SMS?"
https://www.reddit.com/r/explainlikeimfive/comments/1phz967/eli5_i_love_fried_chicken_chicken_sandwiches,Eli5 i love fried chicken chicken sandwiches,"Normal' chicken and turkey, I find delicious. They both have a distinct taste. They taste like...chicken and turkey.

But whenever I try to get into making cold sandwiches, I just can't get over how the sliced chicken and turkey I get from any supermarket deli taste nothing like they normally do. They smell weird, taste weird. They have a strange sort of ham-like scent and flavor to them.

You would think a slice of turkey breast from a deli would taste like...a thin slice of cooked turkey. But it doesn't. It tastes different, and weird.

Why?"
https://www.reddit.com/r/explainlikeimfive/comments/1pjawfv/eli5_how_do_we_stick_our_tongues_out_with_no,Eli5 how do we stick our tongues out with no,
https://www.reddit.com/r/explainlikeimfive/comments/1pj42h0/eli5_why_do_pcs_need_display_driver_updates,Eli5 why do pcs need display driver updates,"I get that driver updates are meant to squash bugs, and whatnot, but I've updated my display driver for the second time in under six months. Tell me why both times, the instant the update came out, my laptop suddenly stopped displaying to my tv, via hdmi? That seems a bit ridiculous to me. It was working fine, without incident, all the way up to the day before. Do you expect me to believe that I just happened to have the first display bug pop up, the exact day the update dropped, both times?

I have a windows 11 laptop. Both times, the ""Detect other display"" setting failed to detect my second display. Yet somehow, when I navigated to the HDR settings, it automatically had it open to edit HDR settings for the second display labeled ""Samsung,"" which is the tv plugged in as the second display, even though the second display is allegedly undetectable.

Edit: based on comments, I'm seeing a bit of misinterpretation. To clarify what I'm referring to... The game optimizations are the graphics driver, not the display driver. The graphics driver, is basically just what manages the functionality of the graphics card. The display driver is what manages the functionality of the internal and external displays, like the laptop screen, and the hdmi port's ability to connect to other monitors.

Also, the problem doesn't occur after I update. I have auto updates turned off. The problem occurs when the update becomes available, then persists, until I manually install the update."
https://www.reddit.com/r/explainlikeimfive/comments/1pha4s9/eli5_how_do_pimple_patches_work_and_why_is_using,Eli5 how do pimple patches work and why is using,Basically the title ¯⁠\⁠_⁠(⁠ツ⁠)⁠_⁠/⁠¯
https://www.reddit.com/r/explainlikeimfive/comments/1pit3v8/eli5_why_does_food_smell_linger_in_the_mouth_even,Eli5 why does food smell linger in the mouth even,"After eating onion or drinking coffee, the smell of onion or coffee lingers in my mouth. Even rigorous rinsing with running water for 3 minutes would not make the smell go away. Why?"
https://www.reddit.com/r/explainlikeimfive/comments/1pi05j2/eli5_why_do_we_tend_to_look_up_when_were_thinking,Eli5 why do we tend to look up when were thinking,
https://www.reddit.com/r/explainlikeimfive/comments/1php74h/eli5_why_do_our_stomachs_make_audible_noise_when,Eli5 why do our stomachs make audible noise when,I’m sitting next to a friend and realized I could hear his stomach(?) making noise. I’m assuming its his stomach because I know I experience something similar when i’m really hungry but I always assumed it was “in my head” but I guess not? Why/how does this happen?
https://www.reddit.com/r/explainlikeimfive/comments/1phhm72/eli5_how_are_ivy_league_colleges_different_from,Eli5 how are ivy league colleges different from,"I’m originally from another country and I’m still trying to understand how the college system works in the US. I hear a lot about “Ivy League” schools, but I’m not sure what actually makes them different from normal state colleges. Is it academic level, history, money, prestige, or something else?"
https://www.reddit.com/r/explainlikeimfive/comments/1phsv0e/eli5_do_emf_protection_biochips_do_anything,Eli5 do emf protection biochips do anything,Trying to explain to my mother who has spent a couple hundred dollars on these that she may have succumbed to snake oil marketing…. Please explain whether or not these stickers that “protect from EMF” are at all useful?
https://www.reddit.com/r/explainlikeimfive/comments/1pixjbc/eli5_why_does_stepping_on_a_lego_hurt_way_more,Eli5 why does stepping on a lego hurt way more,
https://www.reddit.com/r/explainlikeimfive/comments/1pi4v1f/eli5_corresponding_pain,Eli5 corresponding pain,Assuming that a pain at the tip of the thumb that corresponds with a slight throbbing pain in the  bottom front teeth is  a connection in the nervous system but I dont understand why. What connects them?
https://www.reddit.com/r/explainlikeimfive/comments/1phc17j/eli5_how_did_the_1929_crisis_happen,Eli5 how did the 1929 crisis happen,Why did the economy collapse and people run out of food?
https://www.reddit.com/r/explainlikeimfive/comments/1ph0lnr/eli5_as_you_get_older_why_does_your_tolerance_for,Eli5 as you get older why does your tolerance for,"Many adults and even young adults cannot drink the same cup of lemonade that they used to be able to without having to dilute with water. Is there any biological reason why this happens as we grow older? However, this also is more of a bell curve in which the youngest and the oldest like sweet items but the mid-range age groups tend to trend toward a lower tolerance"
https://www.reddit.com/r/explainlikeimfive/comments/1piqcxq/eli5_what_is_a_joke_chain,Eli5 what is a joke chain,"I was doing research on how old cartoons were made and the term “Joke Chain” popped up a few times.

Is it like going from different joke to joke like how does it work? Are there any simple guides or tips to it?"
https://www.reddit.com/r/explainlikeimfive/comments/1phktwk/eli5_why_do_moths_like_light,Eli5 why do moths like light,
https://www.reddit.com/r/explainlikeimfive/comments/1phl50z/eli5why_we_see_some_stars_light_flicker_while,Eli5why we see some stars light flicker while,
https://www.reddit.com/r/explainlikeimfive/comments/1phd90s/eli5_how_is_a_silicon_computer_chip_created,Eli5 how is a silicon computer chip created,And what makes it so difficult Taiwan is one of the few countries that can do it so well?
https://www.reddit.com/r/explainlikeimfive/comments/1pgsyhq/eli5_how_dogs_are_chill_in_both_hot_and_cold,Eli5 how dogs are chill in both hot and cold,"It’s currently 40°F/4°C with a windchill of 33°F/0.5°F and I just saw a homeless man put a blanket around his pit bull while he was panhandling and the pit bull immediately walked out from under it and started roaming around while the man was panhandling, and when the homeless man came back to his dog he put the blanket on him again and the pit bull walked out from under it again and started roaming around.

How do they not care what temp it is outside? They just act like it’s not cold, but when it’s hot, they don’t care either - both pit bulls and Great Pyrenees - meanwhile people are dressing in either tank tops or bundling up in coats to not die from either heatstroke or hyperthermia."
https://www.reddit.com/r/explainlikeimfive/comments/1ph3m5w/eli5_why_did_the_cold_war_make_us_americans_go_to,Eli5 why did the cold war make us americans go to,"I understand nobody necessarily wanted to nuke each other, but the fear was there. And so why did that inspire us to then decide to try to go literally outside of the Earth and step foot on the moon???"
https://www.reddit.com/r/explainlikeimfive/comments/1phda07/eli5_why_do_lithiumion_batteries_drain_faster_in,Eli5 why do lithiumion batteries drain faster in,"Hi all,

title says it all... my outdoour weatherstation is drained within a day..."
https://www.reddit.com/r/explainlikeimfive/comments/1phakc1/eli5_what_decides_what_wavelength_light_has,Eli5 what decides what wavelength light has,"what factor decides the wavelength of the light itself, and thus the color we see? is the intensity of the reaction that produces light what decides how long their wavelength is?

and I have another slightly related question that I thought if as I wrote this. what gives objects their color upon reflecting litht? what I know about is, in the case of plants, they absorb all the high-energy wavelengths and leaves(pun unintended) the wavelength that we percieve as green. but what makes the rest of the world's objects have their color? is it the number of electrons, maybe? but how exactly do some things look yellow, or purple, or red when a light is shined on them?

the first question is about the color of the light itself, the second one is about the colors of objects. and to also add to them yet again, how does phosporus have a different color depending on which angle you look at it from? I have a ""phosphor-coated clock"" that depending on if I look at it from the right or left, changes color from red, green, and blue. how does phosphorous do that?"
https://www.reddit.com/r/explainlikeimfive/comments/1pilb14/eli5_how_do_windmills_work,Eli5 how do windmills work,I have exams on monday about windmills and i still dont know how they work/how they make enrgy. HELP
https://www.reddit.com/r/explainlikeimfive/comments/1pih2vh/eli5_what_are_the_health_benefits_of_having_a_6,Eli5 what are the health benefits of having a 6,"I know everyone has one, rectis abdominis, but for a majority it's covered by a layer of fat. I've tried searching but I haven't seen health benefits, besides good looks and ego, of having a six pack. I mean obviously if you're overweight or obese that's bad, but if you're just average weight with no six pack? Is it really worth starving yourself and sacrificing with carb counting just to look shredded?"
https://www.reddit.com/r/explainlikeimfive/comments/1pgin7m/eli5_why_is_it_bad_to_hit_breaks_when_going_over,Eli5 why is it bad to hit breaks when going over,
https://www.reddit.com/r/explainlikeimfive/comments/1pgdzz8/eli5_why_are_mountains_like_uluru_and_kailash_not,Eli5 why are mountains like uluru and kailash not,"When I visited Australia in 2017, few of my friends  went on a hiking trip. They climbed the red mountain locally known as Uluru as part of their tour itinerary.

Recently I have come to know that people no longer climb this mountain. While researching this I have come across a talk by the mystic Sadhguru. He explained the significance and reverence of Kailash mountain. Also I got to know that mount Kailash even though smaller that Everest has never been summited.

Do you know of any other mountains and geographical structures in your country which people don't climb or approach?"
https://www.reddit.com/r/explainlikeimfive/comments/1pgzgzq/eli5_how_do_mathematicians_come_up_with_new,Eli5 how do mathematicians come up with new,"This is something that has always boggled me. Despite browsing and reading the interwebs, I am still left confused. So far I've gathered that:

1) A new number system can be defined as a set of values, and two operations, a + and a * with properties for each of them

Let us take positive integers for a moment. The set of values would be 1 till +inf. The operations + and * would be addition and multiplication. So that would describe how the system of positive integers work

I then read about quaternions. Instead of one real value, you have 3 complex values and 1 real value. You get two operations yes, but said operations lose properties compared to what we had with positive integers (no associativity for instance), which seemed arbitrary to me. And these go on and on with octonions, hyperreals, extensions of number systems and what not leaving me very confused

I) Who defines what a new system looks or works like? For example with the simplest case of positive integers, what defined multiplication to work that way? If that operation only needs commutativity and associativity, couldn't there be MANY suitable operations with those properties that aren't exactly like multiplication?

II) What's with the weird loss of properties? Complexes lose easy magnitude comparisons, quaternions lose associativity of multiplication and so on. Why can't we just define a quaternion system that just happens to have associative multiplication?"
https://www.reddit.com/r/explainlikeimfive/comments/1phhdo5/eli5_why_does_wavelength_affect_diffraction_not,Eli5 why does wavelength affect diffraction not,I can understaand how gap size affects diffraction visually with huygens principle it's intuitive but not wavelength. All I can think of is smaller wavelengths cause more sidewaays interference to the point thaat the side ways wavefront of the wavelets are canceelled completely.
https://www.reddit.com/r/explainlikeimfive/comments/1pgnpqn/eli5_why_is_it_said_that_every_electron_is_the,Eli5 why is it said that every electron is the,"So I'm no physicist but every time the one electron universe theory is brought up, the argument is made that every electron we've ever measured is exactly the same in their mass charge etc.

But isn't that also true for protons or neutrons or other particles? Then why not a one proton one electron one neutron universe?"
https://www.reddit.com/r/explainlikeimfive/comments/1pi2oca/eli5_to_all_python_developers_please_explain_to,Eli5 to all python developers please explain to,
https://www.reddit.com/r/explainlikeimfive/comments/1pi4f07/eli5_why_do_men_grow_beards_and_women_dont,Eli5 why do men grow beards and women dont,
https://www.reddit.com/r/explainlikeimfive/comments/1pgnldr/eli5_why_are_chicken_eggs_that_shape,Eli5 why are chicken eggs that shape,"Just curious as to why chicken eggs are that shape, rather than spherical or more oblong or at least not having one end more tapered than the other. Is that true for other avians as well?"
https://www.reddit.com/r/explainlikeimfive/comments/1pgmt6z/eli5_someone_please_explain_the_physics_behind,Eli5 someone please explain the physics behind,"I've been wondering this for YEARS! When I have a bowl of Cheerios, and I'm down to the last bite...say about 5 O's remaining, they float on the surface of the milk and they clump together, floating around as one unit! When I swirl the milk with my spoon to break up the clump, the O's separate temporarily, but given another minute or so, they all clump back together again as a single unit! WHY!?"
https://www.reddit.com/r/explainlikeimfive/comments/1phaccv/eli5how_do_inertial_navigation_systems_allow_you,Eli5how do inertial navigation systems allow you,
https://www.reddit.com/r/explainlikeimfive/comments/1pi2102/eli5_why_can_you_hammer_wood_without_breaking_it,Eli5 why can you hammer wood without breaking it,"I noticed something interesting. You can hit a piece of wood with a hammer again and again and it usually won’t break. But if you do the same to a stone, it cracks instantly.

But then I wondered why wood isn’t used the same way as stone or brick for building walls."
https://www.reddit.com/r/explainlikeimfive/comments/1phyjg5/eli5_just_watched_a_red_bull_vid_of_a_person,Eli5 just watched a red bull vid of a person,
https://www.reddit.com/r/explainlikeimfive/comments/1pgdvl6/eli5_why_put_an_arch_over_a_straight_flat_bridge,Eli5 why put an arch over a straight flat bridge,"For example, you have a bridge crossing a river from point A to point B. But then this bridge gets an arch put over it. How does this help?"
https://www.reddit.com/r/explainlikeimfive/comments/1pg8rym/eli5_why_does_a_persons_weight_affect_how_their,Eli5 why does a persons weight affect how their,
https://www.reddit.com/r/explainlikeimfive/comments/1pg78jt/eli5_how_the_wealthy_pays_back_loans,Eli5 how the wealthy pays back loans,"I get the premise of I own $1 billion in stock for x company. You should let me borrow $1b dollars and if I don’t pay it back you keep the stock.

How do they pay the loan back though if the original reason for getting it was to not sell the stocks? Can you do a lateral trade for a loan (I “gift you” stocks and you give me money)? I know the ROI out weights the APR you would pay on the money borrowed but I’m not comprehending how they pay the loan company back."
https://www.reddit.com/r/explainlikeimfive/comments/1phbzup/eli5_the_american_justice_system_and_jurors,Eli5 the american justice system and jurors,"As a European with minimal knowledge of the American justice system, how do jurors work? How are they chosen? Why do they have them in the U.S.?

I was recently watching the Diddy documentary on Netflix and realised how easily these jurors could be swayed, or how sometimes “basic” their decision making is. Do they just pick them off the street? Like I wouldn’t lend 12 random people a pencil let alone have them decide about someones life.

Please explain!

EDIT: Thanks everyone for the explanations! Honestly way better than solely looking it up on Chat GPT because I got a lot of different perspectives and also personal experiences. A lot clearer now."
https://www.reddit.com/r/explainlikeimfive/comments/1pgcjkq/eli5_why_does_fermentation_happen_instead_of_mold,Eli5 why does fermentation happen instead of mold,So yeast starts eating the sugar and creates alcohol. Why doesnt it cause mold instead?
https://www.reddit.com/r/explainlikeimfive/comments/1phq6cc/eli5_what_is_torts_law_tort_law_doctrines,Eli5 what is torts law tort law doctrines,Title\^
https://www.reddit.com/r/explainlikeimfive/comments/1pg7eqo/eli5_how_does_hugging_a_pillow_help_you_stand_up,Eli5 how does hugging a pillow help you stand up,"I had surgery and for a month had trouble standing up from a chair or couch.

This happens to almost everybody, so on discharge they gave me a special hug-size pillow, and for those weeks hugging the pillow tightly to my chest made it much easier to stand up. (I was told not to push myself up with my arms because the muscles needed time to heal and pushing myself up put strain in bad places.)

How exactly did hugging a pillow to my chest help?"
https://www.reddit.com/r/explainlikeimfive/comments/1pgpx1a/eli5_how_does_ice_form_only_in_certain_spots_when,Eli5 how does ice form only in certain spots when,"I know water freezes to form ice. But if snow melts, and water forms from that melted snow and then is frozen again to create ice, then why isn't there ice everywhere on the ground?"
https://www.reddit.com/r/explainlikeimfive/comments/1pfuylj/eli5_how_does_gaining_muscle_mass_improve_your,Eli5 how does gaining muscle mass improve your,"I understand that getting rid of excess fat can greatly improve your health, but what does that extra muscle mass (from exercise) do to benefit you?"
https://www.reddit.com/r/explainlikeimfive/comments/1phmza3/eli5_what_is_heisenbergs_uncertainty_principle,Eli5 what is heisenbergs uncertainty principle,
https://www.reddit.com/r/explainlikeimfive/comments/1pggbek/eli5_why_do_some_smells_linger_in_a_room_for,Eli5 why do some smells linger in a room for,
https://www.reddit.com/r/explainlikeimfive/comments/1phj04q/eli5_if_human_waste_is_a_biohazard_why_do_soiled,Eli5 if human waste is a biohazard why do soiled,
https://www.reddit.com/r/explainlikeimfive/comments/1pg9wn8/eli5_how_some_steroids_cause_gynecomastia_breast,Eli5 how some steroids cause gynecomastia breast,
https://www.reddit.com/r/explainlikeimfive/comments/1phfu3r/eli5_where_does_mobile_network_operaters_get,Eli5 where does mobile network operaters get,"In my country, you pay monthly to get 30GB, or pay more to get 50 GB, or this much for unlimited.

My question is - where do they get those gb's in the first place? Who ""manufacture"" them?

How much they cost before they sell them to us?"
https://www.reddit.com/r/explainlikeimfive/comments/1phezvi/eli5_why_didnt_humans_evole_to_have_more_variety,Eli5 why didnt humans evole to have more variety,*i understand that we didn't evolve from the same species* but is there something genetically that we lack? is it possible that in the beginning of human evolution we had different eye colors but they slowly faded out in favor of what color combinations we have now?
https://www.reddit.com/r/explainlikeimfive/comments/1ph9eyy/eli5_why_does_bread_go_stale_so_fast_but_cookies,Eli5 why does bread go stale so fast but cookies,"I’ve noticed that if I leave bread out, it becomes hard and stale in just a day or two, but cookies can stay crunchy for a week or more.

What’s happening here? Is it the ingredients, the way it’s baked, or something else?"
https://www.reddit.com/r/explainlikeimfive/comments/1pfllp5/eli5_my_paternal_greatgrandmother_gave_birth_to,Eli5 my paternal greatgrandmother gave birth to,
https://www.reddit.com/r/explainlikeimfive/comments/1pg2545/eli5_how_does_blownin_insulation_work,Eli5 how does blownin insulation work,"It sounds like magic. Boom, now your house is insulated. How does it travel to all the nook and cranny?"
https://www.reddit.com/r/explainlikeimfive/comments/1ph4547/eli5_why_does_this_stars_diffraction_look_like,Eli5 why does this stars diffraction look like,"This is probably more of an astronomy question... I just found a new photo from NASA, from the James Webb telescope, it's the photo of the binary wolf rayet apep star system.. on the side of the image is a star with strange spiking ....But why does this stars spikes look so complex compared to other star spikes in photographs? I can't post a photo, but if you know what I'm talking about ..... Please explain (like I'm 5)"
https://www.reddit.com/r/explainlikeimfive/comments/1pfvxtp/eli5_how_is_heat_released_during_nuclear_fusion,Eli5 how is heat released during nuclear fusion,"I’ve read so many explanations of nuclear fusion and star formation, but when they get to the part about hydrogen atoms fusing together to form helium, it always says like “this produces energy/heat”. But howwww? Why do 2 separate atoms have more mass than when they fuse? If it takes energy to bind them together, then how is it released? What am I missing?"
