url,title,post_text
https://www.reddit.com/r/explainlikeimfive/comments/1psq6x7/eli5_why_does_our_brain_sometimes_forget_a_word,Eli5 why does our brain sometimes forget a word,"Sometimes I know a word perfectly, but in the moment I just can’t recall it even though it feels like it’s “on the tip of my tongue.” Then later, when I’m not thinking about it, the word suddenly pops into my head. Why does the brain do this, and what’s happening behind the scenes when this occurs?"
https://www.reddit.com/r/explainlikeimfive/comments/1psjmb9/eli5_how_does_growing_muscles_through_lifting,Eli5 how does growing muscles through lifting,
https://www.reddit.com/r/explainlikeimfive/comments/1psu8h3/eli5_why_can_a_us_credit_score_drop_after_you_pay,Eli5 why can a us credit score drop after you pay,
https://www.reddit.com/r/explainlikeimfive/comments/1psdmj9/eli5_how_did_full_organ_systems_like_the,Eli5 how did full organ systems like the,I don't see how very small changes in genes overtime can lead to something like the lungs.
https://www.reddit.com/r/explainlikeimfive/comments/1psty0m/eli5_why_is_ray_tracing_so_hard_if_rasterization,Eli5 why is ray tracing so hard if rasterization,
https://www.reddit.com/r/explainlikeimfive/comments/1psmivz/eli5_why_no_matter_how_big_the_showmovies_budget,Eli5 why no matter how big the showmovies budget,
https://www.reddit.com/r/explainlikeimfive/comments/1ps5uk4/eli5_how_come_digital_clocks_gain_or_lose_time,Eli5 how come digital clocks gain or lose time,Like the clock in my car or on my microwave. They tend to lag or lead compared to the “real” time after a few weeks
https://www.reddit.com/r/explainlikeimfive/comments/1psvzpp/eli5_if_the_large_shareholders_of_tesla_keep,Eli5 if the large shareholders of tesla keep,
https://www.reddit.com/r/explainlikeimfive/comments/1psodrj/eli5_how_wireless_information_is_transmitted_by,Eli5 how wireless information is transmitted by,
https://www.reddit.com/r/explainlikeimfive/comments/1psug3s/eli5_how_does_muscle_memory_work_if_were_not,Eli5 how does muscle memory work if were not,
https://www.reddit.com/r/explainlikeimfive/comments/1prn4xx/eli5_why_do_broken_jaws_not_happen_all_the_time,Eli5 why do broken jaws not happen all the time,"My perception as an outsider is they are not very common (I maybe wrong) but what makes professional boxers more resilient to this? Jake Paul who, while he has experience, is closer to the “average person”, fought a heavyweight champion and got his jaw broken from basically the first hard punch he received. Meanwhile fighters normally take many of these without this happening. How do they do it?"
https://www.reddit.com/r/explainlikeimfive/comments/1prw9pl/eli5_why_is_haiti_so_relatively_unstable_comapred,Eli5 why is haiti so relatively unstable comapred,
https://www.reddit.com/r/explainlikeimfive/comments/1psw5ax/eli5_childrens_educational_games_how_do_they,Eli5 childrens educational games how do they,"I keep hearing that children’s educational games can help kids understand things faster or remember better, but I don’t really get how that works.
What is it about these children’s educational games that actually improves learning?
Could someone explain it in very simple terms?"
https://www.reddit.com/r/explainlikeimfive/comments/1ps5j9t/eli5_what_is_higgs_field,Eli5 what is higgs field,"I just learned about it, and I can’t imagine how this thing exists. It’s everywhere, and without it, nothing can exist. But where did it come from? How could it exist before anything else? Because if it didn’t, the universe couldn’t expand, right? But I still don't understand many things about it."
https://www.reddit.com/r/explainlikeimfive/comments/1psw9ti/eli5_do_magnets_have_maximal_attracting_range_or,Eli5 do magnets have maximal attracting range or,Is there a limit where they don't do anything?! Or do exoplanets influence things here on earth but it's too small too measure?
https://www.reddit.com/r/explainlikeimfive/comments/1prnu0a/eli5_why_do_we_suddenly_need_so_many_data_centers,Eli5 why do we suddenly need so many data centers,
https://www.reddit.com/r/explainlikeimfive/comments/1prwwox/eli5_why_are_some_captchas_just_a_tickbox_and,Eli5 why are some captchas just a tickbox and,"So sometimes the CAPTCHA on a website is just ""Tick the box to prove you're human"", and you tick the box and off you go to do whatever it is you want to do on the site.

Others have puzzles of various kinds, with or without also having the tickbox.

So...how come a plain old tickbox is adequate? Bots and AIs somehow can't recognise ""Tick the box to prove you're human"" and tick the box? And if that's the case...then why aren't all CAPTCHAs just a tickbox?"
https://www.reddit.com/r/explainlikeimfive/comments/1przbkt/eli5_what_is_ham_radio_used_for,Eli5 what is ham radio used for,Edit: also why can people get it on their vehicles license plate?
https://www.reddit.com/r/explainlikeimfive/comments/1ps866j/eli5_why_do_some_animals_age_faster_slower_than,Eli5 why do some animals age faster slower than,"Was just thinking about how when calculating a dogs ‘human age’ you multiply their dog age by 7, meaning they basically age 7 human years in one calendar year. What’s the science behind this? At first I thought it was to do with size but you have animals such as parrots who can live up to age 50 and tortoises who can live crazy long. Answers from anyone more knowledgeable than me would be greatly appreciated 🙏"
https://www.reddit.com/r/explainlikeimfive/comments/1psdohd/eli5_how_do_transition_lenses_work,Eli5 how do transition lenses work,"Can someone please explain how transition lenses work?

Chemistry / Engineering idk"
https://www.reddit.com/r/explainlikeimfive/comments/1prtabk/eli5_why_do_we_get_hot_when_we_get_angry,Eli5 why do we get hot when we get angry,
https://www.reddit.com/r/explainlikeimfive/comments/1ps8t7c/eli5_why_does_moving_air_make_the_same,Eli5 why does moving air make the same,"The same air temperature can feel very different depending on whether the air is still or moving, like wind or a fan.

Why does air movement change how temperature feels on the body?"
https://www.reddit.com/r/explainlikeimfive/comments/1ps8mrh/eli5_what_a_mood_stabiliser_does_and_how_it_works,Eli5 what a mood stabiliser does and how it works,
https://www.reddit.com/r/explainlikeimfive/comments/1prlo0o/eli5_why_does_modern_480p_video_quality_look_so,Eli5 why does modern 480p video quality look so,"Back in the day, 480p was the top quality and looks very clear. Nowadays it is pixelated af. Why?"
https://www.reddit.com/r/explainlikeimfive/comments/1prhvea/eli5_what_is_the_science_for_having_to_bake_off,Eli5 what is the science for having to bake off,Why does dessert have to reach 190-200F for it to be considered safe to eat when ecoli dies at 165F?
https://www.reddit.com/r/explainlikeimfive/comments/1ps4t30/eli5_why_do_we_feel_hungry_even_when_we_ate,Eli5 why do we feel hungry even when we ate,
https://www.reddit.com/r/explainlikeimfive/comments/1prnfmk/eli5_why_do_we_have_different_blood_types_whats,Eli5 why do we have different blood types whats,"I know I'm A+ and can't get B blood, but why? What's actually different on a microscopic level? If blood is just carrying oxygen and nutrients, why does the body care so much about these types that it will attack the wrong one? And why did we evolve to have different types in the first place?"
https://www.reddit.com/r/explainlikeimfive/comments/1privzk/eli5_why_do_graphics_settings_like_shadows_affect,Eli5 why do graphics settings like shadows affect,
https://www.reddit.com/r/explainlikeimfive/comments/1prv79s/eli5_difference_between_bayesian_vs_frequentist,Eli5 difference between bayesian vs frequentist,"The only thing in my head is that I should use Frequentist when data is plenty and Bayesian when data is scarce. As for why, I have no idea."
https://www.reddit.com/r/explainlikeimfive/comments/1psvqp2/eli5_if_i_jump_inside_an_airplanedo_i_end_up_in,Eli5 if i jump inside an airplanedo i end up in,
https://www.reddit.com/r/explainlikeimfive/comments/1psw81r/eli5_does_a_plane_have_breaks_why_or_why_not,Eli5 does a plane have breaks why or why not,
https://www.reddit.com/r/explainlikeimfive/comments/1prl6ho/eli5_why_is_there_so_little_wind_at_the_equator,Eli5 why is there so little wind at the equator,I watch sailing videos and always around the equator they hit doldrums or little to no wind.  But most don't sail around south america because the wind is too extreme at times.  Why?
https://www.reddit.com/r/explainlikeimfive/comments/1prgt5i/eli5_why_does_a_higher_humidity_seem_to_make,Eli5 why does a higher humidity seem to make,"Started putting a humidifier in my bedroom at night and now wake up hot. I don’t think the temperature has changed, but maybe the electric baseboard sensor is effected too?"
https://www.reddit.com/r/explainlikeimfive/comments/1psw4n9/eli5_if_women_can_make_babies_with_organs_why,Eli5 if women can make babies with organs why,
https://www.reddit.com/r/explainlikeimfive/comments/1pqtfnl/eli5why_cant_we_use_certain_symbols_in_file_names,Eli5why cant we use certain symbols in file names,
https://www.reddit.com/r/explainlikeimfive/comments/1pr1u3z/eli5_why_did_emperor_hirohito_escape_trial_or,Eli5 why did emperor hirohito escape trial or,"Hirohito was not judged despite his responsibility in WWII,  I have often read it was justified by the need to maintain Japan'sstability.  But even so, considering the amount of human losses and tragedies, why was he not judged?"
https://www.reddit.com/r/explainlikeimfive/comments/1psdre3/eli5_why_cant_you_use_your_phone_in_petrol,Eli5 why cant you use your phone in petrol,"I saw on the safety signs while I was filling up today that it still says to turn your phone off while getting petrol. Meanwhile, I just used Apple Pay to prepay for my fuel. Why is it an issue in the first place and how come Apple Pay is ok?"
https://www.reddit.com/r/explainlikeimfive/comments/1prnyt8/eli5_milk_math_question,Eli5 milk math question,"When a recipe calls for evaporated milk, sweetened condensed milk, and milk: Isn’t that just two intensified milks and sugar? Why not just use more intensified milk and skip regular milk and then add a touch of water or something? Is something really going on here?"
https://www.reddit.com/r/explainlikeimfive/comments/1pqpu2h/eli5_how_can_a_64square_chessboard_have_more_game,Eli5 how can a 64square chessboard have more game,"I was reading a book earlier and came across this statement. I honestly thought it was a typo or just completely false. I mean, the universe is massive—billions of galaxies, stars, planets, and everything in them.

I looked it up to prove it wrong, but apparently, it’s a known fact (Shannon’s number vs. atoms in the observable universe).

I logically understand that 10\^{120} is way bigger than 10\^{80}, but intuitively, it makes zero sense to me. How does a small board with limited pieces outnumber the physical matter of the entire observable universe so quickly? Can someone help me visualize this scale?"
https://www.reddit.com/r/explainlikeimfive/comments/1prl8tx/eli5_how_does_sunlight_into_the_eyes_cause,Eli5 how does sunlight into the eyes cause,
https://www.reddit.com/r/explainlikeimfive/comments/1pqw495/eli5_what_was_winter_like_on_pangea,Eli5 what was winter like on pangea,Basically just the title. I'm curious how much different seasons would have been with the ocean currents having to navigate one extremely large mass of land instead of the split continents that we know today?
https://www.reddit.com/r/explainlikeimfive/comments/1ps7mhm/eli5_how_do_thermometers_work,Eli5 how do thermometers work,This just confused me so much. 😅 Especially for very high or low temperatures.
https://www.reddit.com/r/explainlikeimfive/comments/1psak33/eli5_what_does_the_flash_button_do_on_a_telephone,Eli5 what does the flash button do on a telephone,I have a telephone and i tried pressing the flash button once while calling but it just briefly paused the call i think
https://www.reddit.com/r/explainlikeimfive/comments/1pqhqhy/eli5_how_does_a_computer_physically_write_data,Eli5 how does a computer physically write data,
https://www.reddit.com/r/explainlikeimfive/comments/1prna5z/eli5_the_difference_between_new_world_and_old,Eli5 the difference between new world and old,I cant seem to get the concept round my head :(
https://www.reddit.com/r/explainlikeimfive/comments/1prywo3/eli5_why_do_you_forget_the_event_of_getting,Eli5 why do you forget the event of getting,"I’ve personally had it happen twice as an adult and the doctors at the hospital said it happens sometimes but didn’t explain why. I sprained my ankle badly coming down the stairs, and another time snapped my arm doing a cartwheel. I can’t remember what happened when I got the injury, just right before it happened and directly after when I was on the ground.

Why does this happen? If there’s no head injury, why would the brain block it out?"
https://www.reddit.com/r/explainlikeimfive/comments/1ps7a2q/eli5_why_is_the_ratio_of_a_circles_circumference,Eli5 why is the ratio of a circles circumference,"i know the proofs already. i know the size of a circle wont affect the pi constant. i know how we calculated it. My question is, why is it exactly pi?

To give you more context, we discovered pi and didn't invent it. pi will always be 3.141...... . Why? is this set by our reality itself? I'm sorry if  this isn't the right sub to ask this."
https://www.reddit.com/r/explainlikeimfive/comments/1pr17gr/eli5in_a_recent_video_hank_green_says_the_self_is,Eli5in a recent video hank green says the self is,"It won't let me link, but here is the transcript
""But what you forgotten is that the self is an illusion, it is a fake idea that was created through a process of natural selection to help a bunch of genes pass themselves on to the next generation, because beings I have a sense of self were better at passing their genes on""

When did beings gain a sense of self, and why would that be advantageous and what does it have to do with a beings ability to get their genes passed on? Does he mean for humans specifically?
Thank you"
https://www.reddit.com/r/explainlikeimfive/comments/1przzfe/eli5_how_do_bulletproof_vests_work,Eli5 how do bulletproof vests work,
https://www.reddit.com/r/explainlikeimfive/comments/1ps0yup/eli5_why_can_most_computers_readwrite_cdsdvds_but,Eli5 why can most computers readwrite cdsdvds but,"Hi everyone,

Hoping I can get some discussion going about why most computers read/write CDs/DVDs but not M-Disc Blu Ray (or Blu Ray in general in some cases)?

Is it a software protocol issue more than a hardware issue?

Thank you!!"
https://www.reddit.com/r/explainlikeimfive/comments/1pqxo5j/eli5_why_does_cold_water_feel_more_suffocating,Eli5 why does cold water feel more suffocating,"When washing my face in the shower or at the sink, I notice that when I use warm/hot water, I don't have much of a reaction and feel fine. However, when I use cold water, I suddenly feel shocked and feel the need to gasp for air. If cold water is hitting my face for more than a few seconds, it feels like I can't breathe. Why does this happen?"
https://www.reddit.com/r/explainlikeimfive/comments/1pqtbps/eli5_how_does_a_floppy_disk_work,Eli5 how does a floppy disk work,How does a floppy disk work? I remember there's a small magnetic disk inside.Does the size of the diskette change anything?
https://www.reddit.com/r/explainlikeimfive/comments/1pra6b6/eli5_what_does_playing_the_changes_mean_in_the,Eli5 what does playing the changes mean in the,"The most basic interpretation I can think of is ‘only playing notes from the underlying only chord’.

I think that’s got something to do with it, but jazz is full of chromaticism and ‘outside’ notes and stuff, so there’s got to be more to it than just arpeggiating the chord sheet.

Please help!"
https://www.reddit.com/r/explainlikeimfive/comments/1pq4pfk/eli5_how_do_buy_now_pay_later_companies_make,Eli5 how do buy now pay later companies make,"Companies like klarna, afterpay and affirm let you buy things now and split the payment into chunks with “zero interest” If they’re not charging interest how are they actually making money?

Are they charging the stores instead of the customer?
Do they make money from late fees?
Are they selling user data?
Is there some hidden catch I’m missing?

It feels like they’re just giving out free short term loans which doesn’t make sense unless there’s a profit somewhere. I want to understand the basic business model without the marketing spin.

What’s the simple explanation for how these companies stay profitable?

Was buying something online last night and saw the klarna option pop up and ended up sitting there for twenty minutes playing jackpot city on my phone while trying to figure out how this whole thing actually works."
https://www.reddit.com/r/explainlikeimfive/comments/1prya1g/eli5_how_do_insurance_companies_make_money_if,Eli5 how do insurance companies make money if,
https://www.reddit.com/r/explainlikeimfive/comments/1pqbb72/eli5_why_is_tsmc_so_uniquely_valued_when_asml,Eli5 why is tsmc so uniquely valued when asml,"From what I understand making chips is like making a printed shirt, ASML makes the best printers and TSMC uses it to make the best printed shirts.

It seems like the printing/lithography part of chip making is the most difficult part of  the process and the rest of process are the same as it’s always been so why is hard to make a new chip foundry in America?

Thank you for your time."
https://www.reddit.com/r/explainlikeimfive/comments/1prv5s2/eli5_why_wouldnt_a_tiny_waterwheel_work_to_power,Eli5 why wouldnt a tiny waterwheel work to power,"I explained to my friends that I had an idea for a small, \~1 foot by 1 foot water wheel that would be linked up to my laptop or phone to charge it. They all laughed at me and called me stupid. Why would that not work? Am I an idiot?"
https://www.reddit.com/r/explainlikeimfive/comments/1pps38s/eli5_how_does_a_mosquito_with_a_pin_head_not_even,Eli5 how does a mosquito with a pin head not even,
https://www.reddit.com/r/explainlikeimfive/comments/1pqd844/eli5_what_actually_happens_when_matter_and,Eli5 what actually happens when matter and,"We've all heard they ""annihilate"" each other,  but what exactly is happening? If we had microscopes powerful enough to observe this phenomenon, what might we see? I imagine it's just the components of an atom (the electrons, protons and neutrons specifically and of course whatever antimatter is composed of) shooting off in random directions. Am I close?

Edit: getting some atom bomb vibes from the comments. Would this be more accurate? Only asking because we use radioactive materials to make atomic bombs by basically converting them into energy."
https://www.reddit.com/r/explainlikeimfive/comments/1pplipe/eli5_when_chatgpt_came_out_why_did_so_many,Eli5 when chatgpt came out why did so many,"When ChatGPT was released, it felt like shortly afterwards every major tech company suddenly had its own “ChatGPT-like” AI — Google, Microsoft, Meta, etc.

How did all these companies manage to create such similar large language AIs so quickly? Were they already working on them before ChatGPT, or did they somehow copy the idea and build it that fast?"
https://www.reddit.com/r/explainlikeimfive/comments/1pq33pl/eli5_what_do_blind_people_really_see,Eli5 what do blind people really see,Because we 'see' darkness when our eyes are closed.
https://www.reddit.com/r/explainlikeimfive/comments/1pqv81s/eli5_how_does_blindsight_work_on_a_psychneuro,Eli5 how does blindsight work on a psychneuro,"If you report having no vision but are nevertheless able to process visual stimuli (e.g. walk down a hallway with obstacles without tripping), your mindbrain is obviously accessing the visual input and doing something with it. What exactly prevents you from experiencing it as sight?"
https://www.reddit.com/r/explainlikeimfive/comments/1prdz70/eli5_why_cats_dont_get_periods,Eli5 why cats dont get periods,"dogs gets periods and if im not wrong, dogs are similar to cats. then why do cats don't get periods??"
https://www.reddit.com/r/explainlikeimfive/comments/1ppy7a5/eli5_how_does_tourettes_syndrome_work,Eli5 how does tourettes syndrome work,"I understand that brain messes up with signals, and I can understand ""basic"" tics like twitching or squinting, but why do people meow, say phrases and words? Why does my brain makes me whistle and do finger guns, not just ""natural looking"" things like twitching my head?
Sorry if there's any mistypes or stupidity I'm not fluent in English"
https://www.reddit.com/r/explainlikeimfive/comments/1pq7eqb/eli5_what_difference_do_car_transmissions_have,Eli5 what difference do car transmissions have,"I'm talking about automatic transmissions here. How does the car know how to make it more ""sporty"" when shifted into S or something similar? What does it do when it *is* shifted into S mode? Does it like make the engine run rich or something? I've looked everywhere for an answer but haven't found anything. Thanks a ton!"
https://www.reddit.com/r/explainlikeimfive/comments/1ppx2ju/eli5_whats_the_difference_between_ai_singers_and,Eli5 whats the difference between ai singers and,"I don't know how to word this exactly, but I specifically mean the AI covers you find on Youtube where they make Youtubers sing, or when they have 'what if x artist sang y song?"" What's the difference between AI singing it vs a Vocaloid voice bank? Is there a difference at all?

also to clarify, I don't mean morally/ethically- fully just technical level/how they work. I've seen people fully write songs and use AI to 'sing' them, which kinda just reminds me of vocaloids (aside from the fact that the AI is like... Ariana Grande or Plankton-)

EDIT TO CLARIFY MORE- I only mean the voice part, not the instrumentals or anything. Like, if someone were to make a voice bank of themselves vs use AI."
https://www.reddit.com/r/explainlikeimfive/comments/1ppvv1n/eli5_why_is_there_an_ideal_rep_range_for_muscle,Eli5 why is there an ideal rep range for muscle,"As it says in the title.

Also why does say lifting 2 reps to failure then taking a 10 minute break and repeat,

Or

Lifting light weight to failure then 30 seconds rest  and repeat not work as well?"
https://www.reddit.com/r/explainlikeimfive/comments/1pqeblc/eli5_how_do_pcie_lanes_work,Eli5 how do pcie lanes work,"I’m an experienced PC builder, but personally, I’m embarrassed to admit that I have no idea what lanes are. How can a motherboard, for example, have 4 PCIE slots (5X16, 3X16, 3X16, 3X16) and another have 2 PCIE (5X16, 4X16). In that first example, even though you have all those options, is it possible to experience a bottleneck? What determines the lanes, and how does it become equally divided for tasks because it feels like some motherboards put a lot of features on their board, but if you use them all, they come into conflict with another and cause issues. What effect does M.2 and SATA have on lanes, and what is “bifurcation” or splitting lanes, if they aren’t the same thing? I’m an engineering major, so explaining it mathematically would also work well if needed. Thanks for any help!"
https://www.reddit.com/r/explainlikeimfive/comments/1pq4nd6/eli5_how_does_fire_create_light,Eli5 how does fire create light,
https://www.reddit.com/r/explainlikeimfive/comments/1pr1hkj/eli5_how_do_tax_relief_companies_work,Eli5 how do tax relief companies work,Do all of those tax relief companies on the radio actually do anything or is it all a scam? How can someone just get out of paying the IRS?
https://www.reddit.com/r/explainlikeimfive/comments/1pqis2m/eli5_how_is_the_reverse_of_figuring_out_the_slope,Eli5 how is the reverse of figuring out the slope,"Ok, so 5 is probably a bit young for this one.  But....

The inverse of addition is subtraction.  The inverse of multiplication is division.  They're opposites.  The inverse of exponents is roots.

So how is the inverse of differentiation integration?  How does looking at the volume of a figure created by a function reverse figuring out the slope of a line at a point along that function?"
https://www.reddit.com/r/explainlikeimfive/comments/1ppnnw8/eli5_why_venus_is_hotter_than_mercury_even_though,Eli5 why venus is hotter than mercury even though,
https://www.reddit.com/r/explainlikeimfive/comments/1pr6yrm/eli5_how_is_i_e_a_real_number,Eli5 how is i e a real number,"I would assume that if i^2 is -1, and i is an imaginary number, that  any exponent of i that is not even would also be imaginary, since all real numbers have to have a positive or negative value. But because of Euler’s identity, i^e= e^{i\pi e/2}\) which can be found to be a real number? How is this possible unless pi were also an imaginary number?"
https://www.reddit.com/r/explainlikeimfive/comments/1pq2sgp/eli5_do_deaf_children_acquire_a_first_language,Eli5 do deaf children acquire a first language,"Fell into a rabbit hole about Language acquisition and have been wondering. Is it possible for a child, born deaf, to acquire a first language without ever hearing verbal language? Would they perceive sign language the same way hearing children perceive verbal language? Or would it be more visual processing than linguistic? Would their brain development be any different from that of hearing children, provided they are exposed to the same amount of linguistic immersion with sign? Would they be able to use their first language to learn others? Thanks!!"
https://www.reddit.com/r/explainlikeimfive/comments/1pqsszq/eli5_can_can_explain_what_exactly_are,Eli5 can can explain what exactly are,
